{
  "$schema": "http://json-schema.org/draft-07/schema#",
  "title": "Claude Plugin Manifest Repository Policy Schema",
  "description": "Repository policy schema for .claude-plugin/plugin.json (enforces repository quality rules)",
  "type": "object",
  "required": [
    "name",
    "version",
    "description",
    "author",
    "license",
    "skills",
    "agents"
  ],
  "properties": {
    "name": {
      "type": "string",
      "pattern": "^[a-z0-9-]+$"
    },
    "version": {
      "type": "string",
      "pattern": "^[0-9]+\\.[0-9]+\\.[0-9]+$"
    },
    "description": {
      "type": "string"
    },
    "author": {
      "type": "object",
      "required": ["name"],
      "properties": {
        "name": {
          "type": "string"
        },
        "email": {
          "type": "string"
        },
        "url": {
          "type": "string"
        }
      },
      "additionalProperties": false
    },
    "license": {
      "type": "string"
    },
    "skills": {
      "type": "array",
      "items": {
        "type": "string",
        "pattern": "^\\./"
      },
      "minItems": 1
    },
    "agents": {
      "type": "string",
      "pattern": "^\\./"
    }
  },
  "additionalProperties": false
}
