{
  "name": "engineering-skills",
  "version": "1.0.0",
  "description": "Production engineering skills monorepo for software architecture, planning, implementation, auditing, and optimization.",
  "author": {
    "name": "akshay-diwadkar"
  },
  "license": "MIT",
  "skills": [
    "./skills/engineering/plan-with-senior-dev",
    "./skills/engineering/implement-with-senior-dev",
    "./skills/engineering/github-issue-planner",
    "./skills/engineering/codebase-issue-auditor",
    "./skills/engineering/create-diagram",
    "./skills/engineering/design-codebase-with-senior-dev",
    "./skills/engineering/optimize-codebase-with-senior-dev",
    "./skills/engineering/build-codebase-knowledge"
  ],
  "agents": "./agents/claude/"
}
